{
  "offline": true,
  "checks": {
    "angular/large-components": {
      "options": {
        "maxLoc": 40
      }
    }
  },
  "thresholds": {
    "minOverallScore": 80,
    "maxCriticalVulnerabilities": 0,
    "maxInitialBundleKb": 500,
    "maxCriticalA11yViolations": 0
  },
  "output": {
    "formats": [
      "console"
    ]
  }
}
